filename	description	artistic_tags	width	height	aspect_ratio	file_size_kb	dominant_hue	dominant_saturation	creation_date	processing_order
1.jpg	A black and white photo of people walking down a street	outdoor, urban, natural	512	512	1.0	31.0	0	0	2025-05-25 19:50:03	1
10.jpg	A black and white photo of a woman leaning against a wall	neutral	512	512	1.0	20.0	0	0	2025-05-25 19:50:06	2
100.jpg	A man with no shirt smoking a cigarette	neutral	512	512	1.0	29.9	21	58	2025-05-25 19:50:34	3
101.jpg	A shirtless man sitting at a desk in front of a computer	neutral	512	512	1.0	40.2	23	24	2025-05-25 19:50:34	4
102.jpg	A shirtless man sitting at a table in front of a bookcase	neutral	512	512	1.0	40.8	25	21	2025-05-25 19:50:35	5
103.jpg	A man sitting at a desk writing in a notebook	neutral	512	512	1.0	31.4	22	26	2025-05-25 19:50:35	6
104.jpg	A white horse standing on the side of a road	neutral	512	512	1.0	43.5	30	15	2025-05-25 19:50:36	7
106.jpg	A woman standing on top of a building	urban	512	512	1.0	24.1	280	1	2025-05-25 19:50:36	8
107.jpg	A shirtless man sitting in a chair	neutral	512	512	1.0	39.9	21	29	2025-05-25 19:50:37	9
108.jpg	A man smoking a cigarette in front of a woman	neutral	512	512	1.0	27.7	24	21	2025-05-25 19:50:37	10
109.jpg	A man sitting in front of a woman	neutral	512	512	1.0	27.6	29	13	2025-05-25 19:50:38	11
11.jpg	A black and white photo of a woman	neutral	512	512	1.0	38.8	0	0	2025-05-25 19:50:06	12
110.jpg	A man and a woman sitting in a room	indoor	512	512	1.0	26.5	19	24	2025-05-25 19:50:38	13
111.jpg	A man smokes a cigarette while a woman watches	neutral	512	512	1.0	28.4	20	20	2025-05-25 19:50:39	14
112.jpg	A woman with blonde hair	neutral	512	512	1.0	29.6	205	77	2025-05-25 19:50:39	15
113.jpg	A man smoking a cigarette in front of a window	neutral	512	512	1.0	25.4	9	30	2025-05-25 19:50:40	16
114.jpg	The building is old	urban	512	512	1.0	41.2	37	37	2025-05-25 19:50:40	17
115.jpg	A table with a bowl of food and papers on it	neutral	512	512	1.0	44.4	22	13	2025-05-25 19:50:40	18
116.jpg	A palette with paint and brushes on a table	neutral	512	512	1.0	68.5	269	3	2025-05-25 19:50:41	19
117.jpg	A man sitting on the floor	neutral	512	512	1.0	45.3	221	32	2025-05-25 19:50:41	20
118.jpg	A man sitting on the floor	neutral	512	512	1.0	43.4	240	6	2025-05-25 19:50:41	21
119.jpg	A man sitting on the floor working on a laptop	neutral	512	512	1.0	40.2	12	9	2025-05-25 19:50:42	22
12.jpg	A black and white photo of a woman	neutral	512	512	1.0	41.8	0	0	2025-05-25 19:50:06	23
120.jpg	A man sitting in front of a computer	neutral	512	512	1.0	37.8	10	11	2025-05-25 19:50:42	24
121.jpg	The boy is sitting on the floor	neutral	512	512	1.0	52.4	216	49	2025-05-25 19:50:43	25
122.jpg	A paint palette with a red tag on it	neutral	512	512	1.0	64.4	217	55	2025-05-25 19:50:43	26
123.jpg	A man in a blue jacket	neutral	512	512	1.0	45.3	220	48	2025-05-25 19:50:43	27
124.jpg	A man wearing a blue jacket	neutral	512	512	1.0	39.2	221	35	2025-05-25 19:50:44	28
125.jpg	A man wearing a blue jacket	neutral	512	512	1.0	39.5	222	35	2025-05-25 19:50:44	29
126.jpg	A man sitting on the floor using a cell phone	neutral	512	512	1.0	42.3	218	41	2025-05-25 19:50:45	30
127.jpg	A bar with a bunch of flowers in a vase	natural	512	512	1.0	50.9	13	47	2025-05-25 19:50:45	31
128.jpg	A lamp and a book on a table	neutral	512	512	1.0	31.8	18	65	2025-05-25 19:50:45	32
129.jpg	A lamp sitting on top of a table next to a book	neutral	512	512	1.0	21.9	280	21	2025-05-25 19:50:46	33
13.jpg	A black and white photo of a person in the dark	neutral	512	512	1.0	50.8	0	0	2025-05-25 19:50:07	34
130.jpg	A vase of flowers sitting on a bar counter	natural	512	512	1.0	45.5	16	61	2025-05-25 19:50:46	35
131.jpg	Two people sitting at a table in a restaurant	neutral	512	512	1.0	25.7	34	58	2025-05-25 19:50:47	36
132.jpg	A dog sitting on a chair in a restaurant	neutral	512	512	1.0	29.7	20	83	2025-05-25 19:50:47	37
133.jpg	A man standing in a restaurant	neutral	512	512	1.0	34.1	0	33	2025-05-25 19:50:48	38
134.jpg	A man sitting at a table in front of a window	neutral	512	512	1.0	36.8	6	50	2025-05-25 19:50:48	39
135.jpg	A woman sitting at a table in front of a window	neutral	512	512	1.0	17.9	270	0	2025-05-25 19:50:48	40
136.jpg	A person sitting at a table in front of a window	neutral	512	512	1.0	16.8	0	37	2025-05-25 19:50:49	41
137.jpg	A woman sitting at a table in a bar	neutral	512	512	1.0	49.8	28	36	2025-05-25 19:50:49	42
138.jpg	A woman sitting at a table in a restaurant	neutral	512	512	1.0	45.7	25	53	2025-05-25 19:50:50	43
139.jpg	A man sitting in a chair	neutral	512	512	1.0	51.4	26	52	2025-05-25 19:50:50	44
14.jpg	A black and white photo of a person in the dark	neutral	512	512	1.0	52.3	0	0	2025-05-25 19:50:07	45
140.jpg	A man sitting on a couch	neutral	512	512	1.0	50.6	30	41	2025-05-25 19:50:51	46
141.jpg	A woman taking a picture with a camera	neutral	512	512	1.0	39.0	28	48	2025-05-25 19:50:51	47
142.jpg	A person taking a picture with a camera	neutral	512	512	1.0	30.3	34	57	2025-05-25 19:50:52	48
143.jpg	A man sitting at a bar	neutral	512	512	1.0	41.6	29	59	2025-05-25 19:50:52	49
144.jpg	A glass of beer sitting on a bar	neutral	512	512	1.0	41.1	20	46	2025-05-25 19:50:53	50
145.jpg	A person holding a bunch of black wire	neutral	512	512	1.0	42.5	356	37	2025-05-25 19:50:53	51
146.jpg	A man wearing a leather jacket	neutral	512	512	1.0	40.5	21	52	2025-05-25 19:50:54	52
147.jpg	A man wearing a brown leather jacket	neutral	512	512	1.0	42.4	25	70	2025-05-25 19:50:54	53
148.jpg	The man is wearing a jacket	neutral	512	512	1.0	34.3	15	66	2025-05-25 19:50:55	54
149.jpg	A man wearing a black leather jacket	neutral	512	512	1.0	36.3	18	54	2025-05-25 19:50:55	55
15.jpg	A black and white photo of a woman wearing a veil	neutral	512	512	1.0	39.3	0	0	2025-05-25 19:50:07	56
150.jpg	A woman behind a net	neutral	512	512	1.0	56.8	13	32	2025-05-25 19:50:56	57
151.jpg	A man wearing a brown leather jacket	neutral	512	512	1.0	41.3	23	79	2025-05-25 19:50:56	58
152.jpg	A man standing in front of a bar	neutral	512	512	1.0	33.1	25	61	2025-05-25 19:50:57	59
153.jpg	A man wearing a denim jacket	neutral	512	512	1.0	39.9	25	70	2025-05-25 19:50:57	60
154.jpg	A young man wearing a denim jacket	neutral	512	512	1.0	33.1	30	25	2025-05-25 19:50:57	61
155.jpg	A group of chairs sitting in a bar	neutral	512	512	1.0	33.7	15	33	2025-05-25 19:50:58	62
156.jpg	A person standing next to a bicycle on the street	outdoor, urban, natural	512	512	1.0	46.4	336	4	2025-05-25 19:50:58	63
157.jpg	A man on a bike	neutral	512	512	1.0	49.6	199	13	2025-05-25 19:50:59	64
158.jpg	A man riding a bike down the street	outdoor, urban, natural	512	512	1.0	43.3	180	10	2025-05-25 19:50:59	65
159.jpg	A man riding a bike down a city street	outdoor, urban, natural	512	512	1.0	49.1	105	16	2025-05-25 19:50:59	66
16.jpg	A woman standing in front of a painting	neutral	512	512	1.0	47.7	0	0	2025-05-25 19:50:07	67
160.jpg	A man riding a bike down a city street	outdoor, urban, natural	512	512	1.0	42.5	78	28	2025-05-25 19:51:00	68
161.jpg	A man riding a bike down a city street	outdoor, urban, natural	512	512	1.0	44.8	81	23	2025-05-25 19:51:00	69
162.jpg	A woman with blonde hair	neutral	512	512	1.0	34.6	26	67	2025-05-25 19:51:00	70
163.jpg	A woman standing in front of a mirror	neutral	512	512	1.0	40.2	194	7	2025-05-25 19:51:01	71
164.jpg	A woman standing in front of a mirror	neutral	512	512	1.0	38.2	20	60	2025-05-25 19:51:01	72
165.jpg	A woman standing in front of a mirror	neutral	512	512	1.0	36.4	198	11	2025-05-25 19:51:02	73
166.jpg	A man standing in front of a wall	neutral	512	512	1.0	32.0	12	31	2025-05-25 19:51:02	74
167.jpg	A man standing in front of a wall	neutral	512	512	1.0	31.3	25	34	2025-05-25 19:51:03	75
168.jpg	A man wearing a leather jacket	neutral	512	512	1.0	42.2	26	67	2025-05-25 19:51:03	76
169.jpg	A man wearing a brown jacket	neutral	512	512	1.0	46.3	25	88	2025-05-25 19:51:04	77
17.jpg	A woman in a black dress standing in a smoke filled room	indoor	512	512	1.0	19.7	214	14	2025-05-25 19:50:07	78
170.jpg	A man leaning on a metal pole	neutral	512	512	1.0	45.3	36	22	2025-05-25 19:51:04	79
171.jpg	A man in a white shirt sitting in a red chair	neutral	512	512	1.0	26.5	16	7	2025-05-25 19:51:05	80
172.jpg	An old man wearing a netted shirt	neutral	512	512	1.0	48.9	13	44	2025-05-25 19:51:05	81
173.jpg	A man standing in a room with a net	indoor	512	512	1.0	38.0	0	0	2025-05-25 19:51:06	82
174.jpg	A hand holding a mirror	neutral	512	512	1.0	26.9	22	54	2025-05-25 19:51:06	83
175.jpg	A woman in a black shirt and red necklace	neutral	512	512	1.0	18.4	0	1	2025-05-25 19:51:07	84
176.jpg	A black and white photo of a woman	neutral	512	512	1.0	15.7	280	5	2025-05-25 19:51:07	85
177.jpg	A black and white photo of a woman with long hair	neutral	512	512	1.0	26.7	279	7	2025-05-25 19:51:07	86
178.jpg	A woman with curly hair	neutral	512	512	1.0	17.8	32	24	2025-05-25 19:51:07	87
179.jpg	A woman with curly hair	neutral	512	512	1.0	20.2	21	46	2025-05-25 19:51:08	88
18.jpg	A man walking down the street in a black and white photo	outdoor, urban, natural	512	512	1.0	23.2	280	2	2025-05-25 19:50:08	89
180.jpg	A woman in a red dress standing in an old building	urban	512	512	1.0	27.1	26	4	2025-05-25 19:51:08	90
181.jpg	A woman in a red dress standing in front of a stone archway	neutral	512	512	1.0	37.4	0	5	2025-05-25 19:51:08	91
182.jpg	A woman sitting on a bed with her hand on her chin	neutral	512	512	1.0	19.3	41	15	2025-05-25 19:51:09	92
183.jpg	A woman sitting on top of a wooden chair	neutral	512	512	1.0	20.5	36	10	2025-05-25 19:51:09	93
184.jpg	The reflection of the building	urban	512	512	1.0	19.9	20	60	2025-05-25 19:51:09	94
185.jpg	A person holding a soccer ball at sunset	neutral	512	512	1.0	17.9	320	50	2025-05-25 19:51:10	95
186.jpg	A person holding a balloon in the air	neutral	512	512	1.0	20.6	15	36	2025-05-25 19:51:10	96
187.jpg	A silhouette of a person holding a balloon	neutral	512	512	1.0	18.9	0	28	2025-05-25 19:51:10	97
188.jpg	A silhouette of a person holding a balloon	neutral	512	512	1.0	17.0	270	40	2025-05-25 19:51:11	98
189.jpg	A person holding a balloon in the air	neutral	512	512	1.0	20.8	220	21	2025-05-25 19:51:11	99
19.jpg	A black and white photo of trees in the woods	natural	512	512	1.0	22.3	279	2	2025-05-25 19:50:08	100
190.jpg	A person holding a balloon in the air	neutral	512	512	1.0	18.4	220	21	2025-05-25 19:51:11	101
191.jpg	A light that is lit up in the dark	neutral	512	512	1.0	10.8	300	100	2025-05-25 19:51:12	102
192.jpg	A light in the dark	neutral	512	512	1.0	8.3	300	100	2025-05-25 19:51:12	103
193.jpg	The umbrella is red	neutral	512	512	1.0	26.8	351	78	2025-05-25 19:51:12	104
194.jpg	A view of a street through a round window	outdoor, urban, natural	512	512	1.0	21.5	54	16	2025-05-25 19:51:12	105
195.jpg	The reflection of a person in a mirror	neutral	512	512	1.0	18.0	52	23	2025-05-25 19:51:13	106
197.jpg	A boat in the water	neutral	512	512	1.0	21.5	44	17	2025-05-25 19:51:13	107
199.jpg	A view of the ocean through a window	neutral	512	512	1.0	16.0	86	7	2025-05-25 19:51:14	108
2.jpg	An old car driving down the street in the rain	outdoor, urban, natural	512	512	1.0	34.4	0	0	2025-05-25 19:50:03	109
20.jpg	A black and white photo of a person standing in the sand	neutral	512	512	1.0	37.7	280	3	2025-05-25 19:50:08	110
201.jpg	A view of a body of water from a balcony	neutral	512	512	1.0	23.3	203	13	2025-05-25 19:51:15	111
202.jpg	The shadow of a person holding a cigarette	neutral	512	512	1.0	29.0	197	15	2025-05-25 19:51:15	112
203.jpg	A view of a body of water from a window	neutral	512	512	1.0	19.6	0	5	2025-05-25 19:51:15	113
205.jpg	A woman wearing a red floral head scarf	neutral	512	512	1.0	23.2	7	65	2025-05-25 19:51:16	114
207.jpg	A woman wearing a red floral head scarf	neutral	512	512	1.0	20.1	20	23	2025-05-25 19:51:16	115
208.jpg	A table and chairs on a balcony overlooking a lake	neutral	512	512	1.0	27.4	79	5	2025-05-25 19:51:17	116
209.jpg	A body of water	neutral	512	512	1.0	24.5	16	6	2025-05-25 19:51:17	117
21.jpg	A black and white photo of a tree in a field	natural	512	512	1.0	18.2	280	12	2025-05-25 19:50:08	118
210.jpg	A view of a body of water	neutral	512	512	1.0	20.2	180	1	2025-05-25 19:51:17	119
212.jpg	A view of boats in the water from a window	neutral	512	512	1.0	22.2	105	3	2025-05-25 19:51:18	120
213.jpg	A group of cats sitting on the steps	neutral	512	512	1.0	28.7	30	26	2025-05-25 19:51:18	121
214.jpg	A black cat sitting on the steps of a house	neutral	512	512	1.0	25.8	32	11	2025-05-25 19:51:18	122
215.jpg	A man sitting in a chair	neutral	512	512	1.0	24.9	30	16	2025-05-25 19:51:19	123
216.jpg	A man sitting in a chair	neutral	512	512	1.0	24.5	29	21	2025-05-25 19:51:19	124
217.jpg	A life preserveer hanging on a wall	neutral	512	512	1.0	26.3	36	17	2025-05-25 19:51:19	125
219.jpg	A man riding a bike down a street	outdoor, urban, natural	512	512	1.0	37.5	30	18	2025-05-25 19:51:20	126
22.jpg	A black and white photo of a restaurant	neutral	512	512	1.0	39.4	0	0	2025-05-25 19:50:09	127
220.jpg	A man riding a motorcycle down a street	outdoor, urban, natural	512	512	1.0	24.6	28	17	2025-05-25 19:51:20	128
222.jpg	A man wearing a blue shirt	neutral	512	512	1.0	28.0	35	22	2025-05-25 19:51:21	129
223.jpg	A woman sitting at a table with candles in her hand	neutral	512	512	1.0	14.7	280	21	2025-05-25 19:51:21	130
224.jpg	An octopus hanging on the side of a building	urban	512	512	1.0	27.8	25	68	2025-05-25 19:51:22	131
225.jpg	A woman with blonde hair	neutral	512	512	1.0	24.8	38	7	2025-05-25 19:51:22	132
227.jpg	A woman standing in front of a tree	natural	512	512	1.0	22.3	38	23	2025-05-25 19:51:23	133
228.jpg	A cat sitting on the ground next to a chair	neutral	512	512	1.0	28.8	41	34	2025-05-25 19:51:23	134
229.jpg	A cat sitting on the steps of a building	urban	512	512	1.0	31.8	38	39	2025-05-25 19:51:23	135
23.jpg	A man sitting on the side of a road	neutral	512	512	1.0	38.5	0	0	2025-05-25 19:50:09	136
230.jpg	A fence in front of a building	urban	512	512	1.0	20.1	26	23	2025-05-25 19:51:23	137
231.jpg	A boat is docked at the dock in the water	neutral	512	512	1.0	24.3	40	6	2025-05-25 19:51:24	138
232.jpg	A boat in the water	neutral	512	512	1.0	40.8	47	8	2025-05-25 19:51:24	139
233.jpg	A white boat in the water	neutral	512	512	1.0	25.7	31	13	2025-05-25 19:51:24	140
234.jpg	Black and white portrait of a young woman	neutral	512	512	1.0	15.2	280	2	2025-05-25 19:51:25	141
235.jpg	A woman sitting on a bench looking at the camera	neutral	512	512	1.0	21.7	32	28	2025-05-25 19:51:25	142
236.jpg	A view of a small town with mountains in the background	neutral	512	512	1.0	30.3	8	13	2025-05-25 19:51:25	143
237.jpg	A body of water	neutral	512	512	1.0	39.1	13	11	2025-05-25 19:51:26	144
238.jpg	A man in a hat playing a violin	neutral	512	512	1.0	29.0	280	4	2025-05-25 19:51:26	145
239.jpg	A man playing a violin on a dock	neutral	512	512	1.0	32.5	24	23	2025-05-25 19:51:26	146
24.jpg	An old black and white photo of a woman sitting on a cart	neutral	512	512	1.0	46.7	0	0	2025-05-25 19:50:09	147
240.jpg	A woman standing in front of a white wall	neutral	512	512	1.0	22.4	84	3	2025-05-25 19:51:27	148
241.jpg	A woman standing in front of a white wall	neutral	512	512	1.0	22.5	28	28	2025-05-25 19:51:27	149
242.jpg	A young boy riding a skateboard down a street	outdoor, urban, natural	512	512	1.0	23.6	40	10	2025-05-25 19:51:27	150
243.jpg	A woman standing in front of a food cart	neutral	512	512	1.0	42.0	34	36	2025-05-25 19:51:28	151
244.jpg	A man standing next to a body of water	neutral	512	512	1.0	26.0	195	11	2025-05-25 19:51:28	152
246.jpg	A cross in the middle of a room	indoor	512	512	1.0	21.5	215	36	2025-05-25 19:51:29	153
248.jpg	A view of the ocean from the top of a building	urban	512	512	1.0	22.9	210	19	2025-05-25 19:51:29	154
249.jpg	A view of a body of water	neutral	512	512	1.0	31.5	49	8	2025-05-25 19:51:29	155
25.jpg	A black and white photo of a person holding a picture	neutral	512	512	1.0	13.8	280	4	2025-05-25 19:50:09	156
250.jpg	A white truck parked in front of a building	outdoor, urban	512	512	1.0	27.3	30	10	2025-05-25 19:51:30	157
252.jpg	The cat is white	neutral	512	512	1.0	26.7	24	34	2025-05-25 19:51:30	158
253.jpg	White umbrellas on the beach	neutral	512	512	1.0	40.1	40	3	2025-05-25 19:51:31	159
254.jpg	A woman in a denim dress standing on a street	outdoor, urban, natural	512	512	1.0	26.5	32	21	2025-05-25 19:51:31	160
255.jpg	A woman standing in front of a building	urban	512	512	1.0	27.4	39	16	2025-05-25 19:51:31	161
256.jpg	A cat sitting on top of a wall	neutral	512	512	1.0	20.1	42	10	2025-05-25 19:51:32	162
257.jpg	A woman sitting on a beach chair under an umbrella	neutral	512	512	1.0	57.3	220	29	2025-05-25 19:51:32	163
258.jpg	A bunch of olive trees	natural	512	512	1.0	57.7	120	1	2025-05-25 19:51:32	164
259.jpg	A horse is standing in the middle of a field	neutral	512	512	1.0	69.7	53	7	2025-05-25 19:51:33	165
26.jpg	A car driving down the road at night	neutral	512	512	1.0	14.7	280	1	2025-05-25 19:50:09	166
261.jpg	Trees in the desert	natural	512	512	1.0	36.9	34	30	2025-05-25 19:51:33	167
262.jpg	A black cat laying on a white chair	neutral	512	512	1.0	40.9	216	2	2025-05-25 19:51:34	168
264.jpg	A man sitting at a table with a laptop	neutral	512	512	1.0	28.5	34	29	2025-05-25 19:51:34	169
265.jpg	A boat in the water	neutral	512	512	1.0	24.6	23	12	2025-05-25 19:51:35	170
267.jpg	A view of a town from a hill	neutral	512	512	1.0	40.9	100	3	2025-05-25 19:51:35	171
268.jpg	A bell on the side of a building	urban	512	512	1.0	38.7	60	6	2025-05-25 19:51:36	172
269.jpg	A body of water	neutral	512	512	1.0	41.4	80	1	2025-05-25 19:51:36	173
27.jpg	A woman looking through a smoke filled window	neutral	512	512	1.0	17.3	18	22	2025-05-25 19:50:10	174
271.jpg	A man wearing a tank top	neutral	512	512	1.0	32.7	30	39	2025-05-25 19:51:37	175
272.jpg	A black and white cat	neutral	512	512	1.0	23.9	33	11	2025-05-25 19:51:37	176
274.jpg	A man standing next to a white table	neutral	512	512	1.0	31.9	22	25	2025-05-25 19:51:38	177
275.jpg	A man sitting at a table	neutral	512	512	1.0	31.4	29	0	2025-05-25 19:51:38	178
276.jpg	A pile of dried fruit on a table	neutral	512	512	1.0	55.6	35	14	2025-05-25 19:51:39	179
277.jpg	The water is calm	serene	512	512	1.0	45.4	37	5	2025-05-25 19:51:39	180
278.jpg	A black and white checkered floor	neutral	512	512	1.0	38.0	44	15	2025-05-25 19:51:39	181
28.jpg	A dog looking out the window of a house	neutral	512	512	1.0	22.3	30	10	2025-05-25 19:50:10	182
280.jpg	The chairs are blue	neutral	512	512	1.0	31.9	49	9	2025-05-25 19:51:40	183
281.jpg	A bathroom with a sink and a mirror	indoor	512	512	1.0	40.0	39	24	2025-05-25 19:51:40	184
282.jpg	A view of a church through a window	neutral	512	512	1.0	26.2	46	22	2025-05-25 19:51:40	185
283.jpg	A black and white checkered floor	neutral	512	512	1.0	36.3	37	30	2025-05-25 19:51:41	186
285.jpg	A body of water	neutral	512	512	1.0	39.7	75	2	2025-05-25 19:51:41	187
286.jpg	A close up of a cactus plant in the desert	intimate	512	512	1.0	36.1	44	43	2025-05-25 19:51:42	188
287.jpg	A motorcycle parked in front of a tree	outdoor, natural	512	512	1.0	30.6	60	6	2025-05-25 19:51:42	189
288.jpg	A man walking down a narrow alley way	neutral	512	512	1.0	35.5	37	14	2025-05-25 19:51:42	190
289.jpg	A wooden box with books in it	neutral	512	512	1.0	39.6	0	0	2025-05-25 19:51:43	191
29.jpg	A man with a blue scarf on his head is surrounded by a crowd	neutral	512	512	1.0	26.0	24	21	2025-05-25 19:50:10	192
290.jpg	The building is white	urban	512	512	1.0	45.0	30	5	2025-05-25 19:51:43	193
291.jpg	An old television sitting on top of a dresser	neutral	512	512	1.0	30.4	37	19	2025-05-25 19:51:43	194
292.jpg	A woman in a black coat holding a box	neutral	512	512	1.0	18.1	280	9	2025-05-25 19:51:44	195
293.jpg	A statue of a woman looking out a window	neutral	512	512	1.0	18.3	280	2	2025-05-25 19:51:44	196
294.jpg	The man is wearing a hat	neutral	512	512	1.0	25.3	90	1	2025-05-25 19:51:44	197
295.jpg	A bunch of papers on a wall	neutral	512	512	1.0	24.2	330	0	2025-05-25 19:51:45	198
296.jpg	A white board with a drawing on it	neutral	512	512	1.0	26.9	60	1	2025-05-25 19:51:45	199
297.jpg	A close up of an electrical outlet on a wall	intimate	512	512	1.0	17.2	70	6	2025-05-25 19:51:45	200
298.jpg	A cup with writing on it hanging on a wall	neutral	512	512	1.0	15.8	100	2	2025-05-25 19:51:46	201
299.jpg	A bunch of blue pipes	neutral	512	512	1.0	45.9	231	61	2025-05-25 19:51:46	202
3.jpg	An old black and white photo of a city street	outdoor, urban, natural	512	512	1.0	39.8	0	0	2025-05-25 19:50:04	203
30.jpg	A man in a suit and hat holding a briefcase	neutral	512	512	1.0	32.4	0	0	2025-05-25 19:50:10	204
300.jpg	A bunch of yellow flowers	natural	512	512	1.0	83.4	205	25	2025-05-25 19:51:46	205
301.jpg	A man working on a wall with a hammer	neutral	512	512	1.0	25.9	279	1	2025-05-25 19:51:47	206
302.jpg	A man wearing a hard hat in a factory	neutral	512	512	1.0	26.8	348	40	2025-05-25 19:51:47	207
303.jpg	The tools are laying on the floor	neutral	512	512	1.0	25.9	280	1	2025-05-25 19:51:47	208
304.jpg	A close up of a bird on a chair	intimate	512	512	1.0	47.6	38	32	2025-05-25 19:51:48	209
305.jpg	The leaves are green and red	neutral	512	512	1.0	61.7	31	45	2025-05-25 19:51:48	210
306.jpg	A drawing of a person sitting on a couch	neutral	512	512	1.0	29.1	60	0	2025-05-25 19:51:48	211
307.jpg	The plastic bag is white	neutral	512	512	1.0	23.6	225	2	2025-05-25 19:51:49	212
308.jpg	A ladder with a piece of metal on it	neutral	512	512	1.0	23.6	280	2	2025-05-25 19:51:49	213
309.jpg	A ladder with a piece of plaster on it	neutral	512	512	1.0	24.9	0	0	2025-05-25 19:51:49	214
31.jpg	A person standing on a bridge over a frozen river	neutral	512	512	1.0	39.7	0	0	2025-05-25 19:50:10	215
310.jpg	An old fireplace with a large stone relief on it	neutral	512	512	1.0	29.9	280	16	2025-05-25 19:51:50	216
311.jpg	A clock is on the wall of a building	urban	512	512	1.0	29.8	34	24	2025-05-25 19:51:50	217
312.jpg	A large crowd of people	neutral	512	512	1.0	36.4	48	2	2025-05-25 19:51:50	218
313.jpg	A large group of people	neutral	512	512	1.0	38.7	30	5	2025-05-25 19:51:51	219
314.jpg	A large crowd of people	neutral	512	512	1.0	36.1	40	1	2025-05-25 19:51:51	220
315.jpg	A man in uniform	neutral	512	512	1.0	34.0	30	34	2025-05-25 19:51:51	221
316.jpg	The man is wearing a black coat	neutral	512	512	1.0	34.7	180	7	2025-05-25 19:51:52	222
317.jpg	A clock and a book on a table	neutral	512	512	1.0	40.5	40	6	2025-05-25 19:51:52	223
318.jpg	A book on a table	neutral	512	512	1.0	22.1	36	50	2025-05-25 19:51:52	224
319.jpg	A statue of a man reading a book	neutral	512	512	1.0	20.8	225	3	2025-05-25 19:51:53	225
32.jpg	A person standing on a bridge over a frozen river	neutral	512	512	1.0	43.0	213	7	2025-05-25 19:50:10	226
320.jpg	A book sitting on top of a table	neutral	512	512	1.0	26.1	27	20	2025-05-25 19:51:53	227
321.jpg	A stained glass window with blue and white designs	neutral	512	512	1.0	38.6	240	0	2025-05-25 19:51:53	228
322.jpg	A black and white photo of a skull on a table	neutral	512	512	1.0	29.6	280	2	2025-05-25 19:51:54	229
323.jpg	A piece of clay sitting on a table	neutral	512	512	1.0	29.6	41	35	2025-05-25 19:51:54	230
324.jpg	A black and white photo of origas on a table	neutral	512	512	1.0	18.7	280	2	2025-05-25 19:51:54	231
325.jpg	A black and white photo of a drawing on a piece of paper	neutral	512	512	1.0	22.1	280	2	2025-05-25 19:51:55	232
326.jpg	A black and white photo of an object on a table	neutral	512	512	1.0	20.0	280	1	2025-05-25 19:51:55	233
327.jpg	A bunch of metal parts on a table	neutral	512	512	1.0	31.2	40	21	2025-05-25 19:51:55	234
328.jpg	A room with a lot of furniture in it	indoor	512	512	1.0	31.5	45	35	2025-05-25 19:51:56	235
329.jpg	A black and white photo of a light coming through a window	neutral	512	512	1.0	10.2	280	10	2025-05-25 19:51:56	236
33.jpg	A person standing on a bridge in the snow	neutral	512	512	1.0	41.2	280	10	2025-05-25 19:50:11	237
330.jpg	A black and white photo of a baby in a paper bag	neutral	512	512	1.0	19.8	300	1	2025-05-25 19:51:56	238
331.jpg	A piece of paper on the floor	neutral	512	512	1.0	22.1	40	53	2025-05-25 19:51:57	239
332.jpg	A white bowl filled with dirt on a table	neutral	512	512	1.0	50.8	214	4	2025-05-25 19:51:57	240
333.jpg	A man sitting on a chair in front of a window	neutral	512	512	1.0	19.1	280	15	2025-05-25 19:51:57	241
334.jpg	A man sitting on a chair in front of a window	neutral	512	512	1.0	18.4	300	0	2025-05-25 19:51:58	242
335.jpg	A black and white photo of a man with curly hair	neutral	512	512	1.0	20.8	280	2	2025-05-25 19:51:58	243
336.jpg	A black and white photo of a man with long hair	neutral	512	512	1.0	15.0	280	4	2025-05-25 19:51:58	244
337.jpg	Two polaroids hanging on a wall	neutral	512	512	1.0	20.5	31	38	2025-05-25 19:51:58	245
338.jpg	Two people looking at paintings	neutral	512	512	1.0	28.5	32	62	2025-05-25 19:51:59	246
339.jpg	A group of people standing in a room	indoor	512	512	1.0	20.4	22	80	2025-05-25 19:51:59	247
34.jpg	A black and white photo of a tree in the snow	natural	512	512	1.0	19.8	280	1	2025-05-25 19:50:11	248
340.jpg	A black and white photo of people in a museum	neutral	512	512	1.0	18.1	279	3	2025-05-25 19:51:59	249
341.jpg	A painting of a man reading a book	neutral	512	512	1.0	25.3	27	64	2025-05-25 19:51:59	250
342.jpg	Three people standing in front of a painting	neutral	512	512	1.0	19.8	37	53	2025-05-25 19:52:00	251
343.jpg	A wall with many pieces of paper on it	neutral	512	512	1.0	24.4	44	22	2025-05-25 19:52:00	252
344.jpg	A man in a suit and tie standing in front of a painting	neutral	512	512	1.0	27.4	21	30	2025-05-25 19:52:00	253
345.jpg	A round window with a cross in it	neutral	512	512	1.0	11.3	24	71	2025-05-25 19:52:00	254
346.jpg	A painting on the wall	neutral	512	512	1.0	34.3	20	15	2025-05-25 19:52:01	255
347.jpg	A painting on the wall	neutral	512	512	1.0	38.6	25	11	2025-05-25 19:52:01	256
348.jpg	A sculpture of a chair on a table	neutral	512	512	1.0	25.1	43	10	2025-05-25 19:52:01	257
